{
  "$schema": "https://json-schema.org/draft/2020-12/schema",
  "$id": "https://raw.githubusercontent.com/bikeindex/bikebook/main/schemas/e_vehicle_classification.json",
  "title": "Bikebook e-vehicle classification",
  "type": "object",
  "properties": {
    "$schema": {
      "type": "string",
      "format": "uri"
    },
    "id": {
      "type": "string",
      "pattern": "^evc/[a-z0-9_/]+$",
      "description": "Catalog path, prefixed evc/: jurisdiction/classification slug, or a group's bare slug"
    },
    "jurisdiction": {
      "type": [
        "string",
        "null"
      ],
      "pattern": "^(AR|AU|CA|CH|CN|EU|GB|HK|IN|JP|KR|MY|NO|NZ|PH|PY|SG|TH|TW|US|UY)(-[A-Z0-9]{1,3})?$",
      "description": "ISO 3166-1 alpha-2 country code, or EU, suffixed with a state or province's ISO 3166-2 code, e.g. US-CA; a group, which classifications from any jurisdiction can name, has none"
    },
    "groups": {
      "type": "array",
      "items": {
        "type": "string",
        "pattern": "^evc/[a-z0-9_/]+$"
      },
      "description": "The shared classifications whose definition this one fits, by their ids; a vehicle carries a group's id rather than each state's"
    },
    "name": {
      "type": "string"
    },
    "description": {
      "type": "string"
    },
    "limits_start_on": {
      "type": [
        "string",
        "null"
      ],
      "format": "date",
      "pattern": "^\\d{4}-\\d{2}-\\d{2}$",
      "description": "The day its speed and power limits take effect, when a law not yet in force sets them; its rules carry their own dates"
    },
    "throttle": {
      "type": "boolean",
      "description": "Whether the motor may propel it without the rider pedaling"
    },
    "class_3_throttle": {
      "type": [
        "boolean",
        "null"
      ],
      "description": "False where its law bars a Class 3 from having a throttle at all; left out, a Class 3's throttle has to stop at 20 mph"
    },
    "e_bike_law": {
      "type": [
        "boolean",
        "null"
      ],
      "description": "A jurisdiction's whole e-bike law rather than one class or tier of it, so it goes on a vehicle's assist mode though it allows a throttle"
    },
    "max_speed": {
      "type": [
        "number",
        "null"
      ],
      "description": "The fastest the motor may propel it, in kilometers per hour",
      "x-unit": "km/h"
    },
    "max_throttle_speed": {
      "type": [
        "number",
        "null"
      ],
      "description": "The fastest the motor may propel it on its own, without the rider pedaling, in kilometers per hour",
      "x-unit": "km/h"
    },
    "min_power": {
      "type": [
        "integer",
        "null"
      ],
      "description": "The motor power it's above; a horsepower limit converts at 750 W per hp, as federal law and California's statute do, in watts",
      "x-unit": "w"
    },
    "max_power": {
      "type": [
        "integer",
        "null"
      ],
      "description": "The motor's power limit; restrictions say whether it's inclusive, and a horsepower limit converts at 750 W per hp, in watts",
      "x-unit": "w"
    },
    "restrictions": {
      "type": "array",
      "items": {
        "type": "object",
        "properties": {
          "rule": {
            "type": "string"
          },
          "citation": {
            "type": [
              "string",
              "null"
            ],
            "description": "The statute, regulation or bill that states it, e.g. California Vehicle Code §312.5"
          },
          "starts_on": {
            "type": [
              "string",
              "null"
            ],
            "format": "date",
            "pattern": "^\\d{4}-\\d{2}-\\d{2}$",
            "description": "The day it takes effect; a rule without one is in force now"
          },
          "ends_on": {
            "type": [
              "string",
              "null"
            ],
            "format": "date",
            "pattern": "^\\d{4}-\\d{2}-\\d{2}$",
            "description": "The day it stops applying"
          },
          "sources": {
            "type": "array",
            "items": {
              "type": "string",
              "format": "uri"
            },
            "description": "The pages that state it"
          }
        },
        "required": [
          "rule",
          "sources"
        ],
        "additionalProperties": false
      }
    },
    "sources": {
      "type": "array",
      "items": {
        "type": "string",
        "format": "uri"
      },
      "description": "Pages that back the classification as a whole; a page that states one of its rules goes on that rule instead"
    }
  },
  "required": [
    "id",
    "name",
    "description",
    "throttle",
    "restrictions"
  ],
  "additionalProperties": false
}
