{
  "id": "evc/us/nd/electric_bicycle",
  "jurisdiction": "US-ND",
  "groups": [
    "evc/us/class_1",
    "evc/us/class_2",
    "evc/us/class_3"
  ],
  "name": "Electric Bicycle",
  "description": "A bicycle with fully operable pedals, a saddle or seat and an electric motor of 750 watts or less, in one of three classes: class 1 pedal assist and class 2 throttle, both to 20 mph, and class 3 pedal assist to 28 mph.",
  "throttle": true,
  "e_bike_law": true,
  "max_speed": 45.06,
  "max_power": 750,
  "restrictions": [
    {
      "rule": "Fully operable pedals, a saddle or seat, and a motor of 750 watts or less",
      "citation": "North Dakota Century Code §39-01-01",
      "sources": [
        "https://ndlegis.gov/cencode/t39c01.pdf"
      ]
    },
    {
      "rule": "Class 1 and class 3 assist only while the rider is pedaling, stopping at 20 and 28 mph; class 2 can propel it without pedaling, up to 20 mph",
      "citation": "North Dakota Century Code §39-01-01",
      "sources": [
        "https://ndlegis.gov/cencode/t39c01.pdf"
      ]
    },
    {
      "rule": "The motor must disengage when the rider stops pedaling or applies the brakes",
      "citation": "North Dakota Century Code §39-10.1-09",
      "sources": [
        "https://ndlegis.gov/cencode/t39c10-1.pdf"
      ]
    },
    {
      "rule": "Class 3 must have a functioning speedometer",
      "citation": "North Dakota Century Code §39-10.1-09",
      "sources": [
        "https://ndlegis.gov/cencode/t39c10-1.pdf"
      ]
    },
    {
      "rule": "Carries a permanent label stating its class, top assisted speed and motor wattage",
      "citation": "North Dakota Century Code §39-10.1-09",
      "sources": [
        "https://ndlegis.gov/cencode/t39c10-1.pdf"
      ]
    },
    {
      "rule": "Must not be tampered with to change its motor-powered speed or engagement unless the label is replaced to match",
      "citation": "North Dakota Century Code §39-10.1-09",
      "sources": [
        "https://ndlegis.gov/cencode/t39c10-1.pdf"
      ]
    },
    {
      "rule": "Meets the CPSC's bicycle requirements (16 CFR part 1512)",
      "citation": "North Dakota Century Code §39-10.1-09",
      "sources": [
        "https://ndlegis.gov/cencode/t39c10-1.pdf"
      ]
    },
    {
      "rule": "Riders under 18 must wear a helmet on a class 3",
      "citation": "North Dakota Century Code §39-10.1-09",
      "sources": [
        "https://ndlegis.gov/cencode/t39c10-1.pdf"
      ]
    },
    {
      "rule": "No statewide minimum age",
      "sources": [
        "https://ndlegis.gov/cencode/t39c10-1.pdf"
      ]
    },
    {
      "rule": "Counts as a bicycle under the traffic laws",
      "citation": "North Dakota Century Code §39-01-01",
      "sources": [
        "https://ndlegis.gov/cencode/t39c01.pdf"
      ]
    },
    {
      "rule": "May be ridden on any bicycle or multi-use path unless the governmental entity in charge bans it",
      "citation": "North Dakota Century Code §39-10.1-09",
      "sources": [
        "https://ndlegis.gov/cencode/t39c10-1.pdf"
      ]
    },
    {
      "rule": "Not a motor vehicle, motorcycle or motorized bicycle: no title, registration or driver's license",
      "citation": "North Dakota Century Code §39-01-01",
      "sources": [
        "https://ndlegis.gov/cencode/t39c01.pdf"
      ]
    },
    {
      "rule": "Traffic violations on one put no points on the rider's driving record",
      "sources": [
        "https://ndlegis.gov/cencode/t39c10-1.pdf"
      ]
    }
  ],
  "sources": [
    "https://ndlegis.gov/assembly/67-2021/session-laws/documents/MTRVH.pdf"
  ]
}
